{
  "$schema": "https://json-schema.org/draft/2020-12/schema",
  "$id": "https://firstboot.local/schemas/custom-driver.schema.json",
  "title": "First Boot Linux retailer driver pack",
  "description": "manifest.json inside a shop .zip. Not official-catalog.json. One pack is one distro; editions are desktops (each ISO).",
  "type": "object",
  "additionalProperties": false,
  "required": [
    "schema_version",
    "id",
    "name",
    "version",
    "tagline",
    "description",
    "family",
    "install",
    "editions"
  ],
  "properties": {
    "schema_version": {
      "type": "integer",
      "const": 1
    },
    "id": { "$ref": "#/$defs/id" },
    "name": { "type": "string", "minLength": 1 },
    "version": { "type": "string", "minLength": 1 },
    "tagline": { "type": "string", "minLength": 1 },
    "description": { "type": "string", "minLength": 1 },
    "family": {
      "type": "string",
      "enum": ["ubuntu", "mint", "fedora", "debian", "suse", "windows", "bsd", "other"]
    },
    "install": {
      "$ref": "#/$defs/id",
      "description": "Must equal id. Folder name under payload/custom/ and DRIVER.id in driver.py."
    },
    "secure_boot": {
      "type": "boolean",
      "description": "Installer works with firmware Secure Boot on. Default false (shop-risk). Set true only when the live kernel and bootloader are signed."
    },
    "logo": {
      "type": "string",
      "pattern": "^[^/\\\\]+\\.(png|svg)$",
      "description": "Basename in the zip. Default logo.png."
    },
    "driver": {
      "type": "string",
      "pattern": "^[^/\\\\]+\\.py$",
      "description": "Basename in the zip. Default driver.py. Same API as chooser/firstboot/osinstall/_template.py."
    },
    "editions": {
      "type": "array",
      "minItems": 1,
      "items": { "$ref": "#/$defs/edition" }
    }
  },
  "$defs": {
    "id": {
      "type": "string",
      "pattern": "^[a-z0-9]+(?:-[a-z0-9]+)*$"
    },
    "sha256": {
      "type": "string",
      "pattern": "^[0-9a-f]{64}$"
    },
    "edition": {
      "type": "object",
      "additionalProperties": false,
      "required": ["id", "name", "default", "filename"],
      "properties": {
        "id": { "$ref": "#/$defs/id" },
        "name": { "type": "string", "minLength": 1 },
        "default": {
          "type": "boolean",
          "description": "Exactly one true per pack. Featured card when that desktop is ticked."
        },
        "filename": {
          "type": "string",
          "pattern": "^[^/\\\\]+\\.(iso|img)$",
          "description": "ISO basename written to payload/images/. May live in the zip, next to the zip, or be chosen in the creator."
        },
        "sha256": {
          "$ref": "#/$defs/sha256",
          "description": "Optional pin. When set, the creator rejects an ISO that does not match."
        },
        "size_bytes": {
          "type": "integer",
          "minimum": 1,
          "description": "Optional pin. When set, the creator rejects an ISO of a different size."
        }
      }
    }
  }
}
